{
  "$schema": "https://json-schema.org/draft/2020-12/schema",
  "title": "Review: one implementation checked against the paper",
  "type": "object",
  "additionalProperties": false,
  "required": ["method", "reviewed_sha", "reviewer_agent", "verdict", "discrepancies"],
  "properties": {
    "method": {"type": "string"},
    "reviewed_sha": {"type": "string", "pattern": "^[0-9a-f]{40}$"},
    "reviewer_agent": {"type": "string", "minLength": 1},
    "verdict": {"enum": ["verified", "discrepancies", "unverified"]},
    "summary": {"type": "string"},
    "discrepancies": {
      "type": "array",
      "items": {
        "type": "object",
        "additionalProperties": false,
        "required": ["file", "line", "extraction_id", "page", "description", "severity"],
        "properties": {
          "file": {"type": "string"},
          "line": {"type": "integer", "minimum": 1},
          "extraction_id": {"type": "string"},
          "page": {"type": "integer", "minimum": 1},
          "description": {"type": "string", "minLength": 1},
          "severity": {"enum": ["minor", "major", "blocking"]}
        }
      }
    }
  },
  "allOf": [
    {"if": {"properties": {"verdict": {"const": "discrepancies"}}},
     "then": {"properties": {"discrepancies": {"minItems": 1}}}},
    {"if": {"properties": {"verdict": {"const": "verified"}}},
     "then": {"properties": {"discrepancies": {"items": {"properties": {"severity": {"const": "minor"}}}}}}}
  ]
}
